name,nick_name
多肉的世界,摸鱼的多肉肉
舒伯特的野玫瑰,玫瑰崽
是隻流浪貓啊,猫又又咖啡店店长
木木flynn,健身达人木大师
起了半小时名字,永远的神Jason
大魔王,马上要去韩国当社会人的大魔王
辛丑文豪又葬花,消失了半个世纪的羊驼
catbaron_,窃听风云的海盗喵
昇深,谐音梗小王子深深
一把碎,日常炸厨房的甜品师大班
清风吹过的时光,日常换地方的清风
兮言的小布,和言言甜蜜热恋中的兮兮
W,总是推荐好听歌曲的大补溜
戒急躁,每日都戒急躁的大姐头
小柴柴,总是给多肉肉送花花的小柴柴
黑猫,唱歌超级好听的全能黑猫
幸福猫咪,超级厉害的黑猫家的猫咪
不语丫头,唱歌很好听的朵朵姑娘
Lily,超级贴心的可爱Lily
怪力乱熊,日常熬夜的小熊熊要暴富
多肉葡萄,总是被认为是多肉小号的多肉葡萄
大鹅,每天都在练习唱歌的大鹅
晚安阿fan,玉树临风潇洒倜傥的大凡凡
枫糖,越来越可爱的的笨糖糖
大仙鹅子,会弹吉他的学霸大仙儿
胡兔兔,做饭超级好吃的兔兔
BTX,喜欢逗多肉的BTX
chocolαte sundαe,玩三国杀很厉害的朱古力
热熔的雪糕,热熔的雪糕
美丫电台,说小管家不是人的美丫电台
西瓜不酸但很甜,真诚又勇敢的西瓜
王艺林,努力学习的艺林同学
兑泽,兑泽
Mua莫吉托,多肉的表妹多胖
淤骨美人,超级大美人